{
  "$schema": "https://json-schema.org/draft/2020-12/schema",
  "title": "auto-dao session state",
  "description": "Authoritative session state for a learning session. All other Markdown status files are derived views.",
  "type": "object",
  "required": [
    "schema_version",
    "topic_id",
    "source_path",
    "phase",
    "current_lesson",
    "total_lessons",
    "created_at",
    "updated_at"
  ],
  "properties": {
    "schema_version": {
      "const": "2.3"
    },
    "topic_id": {
      "type": "string",
      "minLength": 1,
      "description": "Human-readable topic identifier, e.g. 'stm32-hal'"
    },
    "topic_name": {
      "type": "string",
      "description": "Human-readable display name of the topic (may include Chinese or non-ASCII chars)"
    },
    "source_path": {
      "type": "string",
      "description": "Path to the original learning material"
    },
    "processed_path": {
      "type": "string",
      "description": "Path to the Markdown-converted material (empty if source is already Markdown)"
    },
    "source_hash": {
      "type": "string",
      "description": "SHA-256 hex digest of the source file, used to detect material changes"
    },
    "phase": {
      "type": "string",
      "enum": ["init", "preprocessing", "learning", "review", "completed"],
      "description": "Current pipeline phase"
    },
    "current_lesson": {
      "type": "integer",
      "minimum": 0,
      "description": "Next lesson to generate or current lesson in progress"
    },
    "total_lessons": {
      "type": "integer",
      "minimum": 0,
      "description": "Planned total number of lessons from roadmap"
    },
    "last_completed_lesson": {
      "type": "integer",
      "minimum": 0,
      "description": "Index of the last fully graded lesson"
    },
    "mastery_passed": {
      "type": "integer",
      "minimum": 0,
      "description": "Cumulative count of correctly answered questions"
    },
    "mastery_failed": {
      "type": "integer",
      "minimum": 0,
      "description": "Cumulative count of incorrectly answered questions"
    },
    "mastery_rate": {
      "type": "number",
      "minimum": 0,
      "maximum": 1,
      "description": "mastery_passed / (mastery_passed + mastery_failed), 0 when no data"
    },
    "counterfactual_mode": {
      "type": ["string", "null"],
      "enum": ["on", "off", "auto", null],
      "description": "Counterfactual reasoning mode. null = not yet decided (will prompt user)"
    },
    "learning_language": {
      "type": "string",
      "description": "ISO 639-1 code for the teaching language, e.g. 'zh', 'en'. Empty = same as material language"
    },
    "wait_reason": {
      "type": ["string", "null"],
      "enum": ["awaiting_answer", "awaiting_grading", "awaiting_user_choice", null],
      "description": "Why the session is blocked, null when not blocked"
    },
    "wait_detail": {
      "type": ["object", "null"],
      "description": "Optional human-readable blocking details. Keep wait_reason machine-stable and put lesson-specific context here.",
      "additionalProperties": true
    },
    "repo_commit_hash": {
      "type": ["string", "null"],
      "description": "Git commit hash of the repository at learning time. Used for incremental learning on revisit. null for non-repo sources."
    },
    "current_mode": {
      "type": "string",
      "enum": ["learn", "practice", "deep", "core"],
      "description": "Current lesson generation mode. New sessions start with learn. core is retained only for legacy session compatibility."
    },
    "lesson_files_learn": {
      "type": "array",
      "description": "Ordered learner-facing learn-card filenames stored under lessons/learn/. New lesson generation writes here first.",
      "items": {
        "type": ["string", "null"]
      }
    },
    "lesson_files_practice": {
      "type": "array",
      "description": "Ordered practice-pack filenames stored under lessons/practice/. Generated after or alongside learn cards when practice is needed.",
      "items": {
        "type": ["string", "null"]
      }
    },
    "lesson_files_core": {
      "type": "array",
      "description": "Legacy ordered core lesson filenames stored under lessons/. New sessions should not append to this list. Transitional nulls are allowed for legacy in-progress sessions.",
      "items": {
        "type": ["string", "null"]
      }
    },
    "lesson_files_deep": {
      "type": "array",
      "description": "Ordered deep lesson filenames stored under lessons/. New lesson generation writes here. Transitional nulls are allowed for legacy in-progress sessions.",
      "items": {
        "type": ["string", "null"]
      }
    },
    "mode_switch_log": {
      "type": "array",
      "description": "Audit trail for switching among learn, practice, deep, and legacy core modes.",
      "items": {
        "type": "object",
        "properties": {
          "at": { "type": "string", "format": "date-time" },
          "from": { "type": ["string", "null"], "enum": ["learn", "practice", "deep", "core", null] },
          "to": { "type": "string", "enum": ["learn", "practice", "deep", "core"] },
          "reason": { "type": "string" }
        },
        "required": ["at", "to", "reason"],
        "additionalProperties": false
      }
    },
    "created_at": {
      "type": "string",
      "format": "date-time",
      "description": "ISO 8601 timestamp of session creation"
    },
    "updated_at": {
      "type": "string",
      "format": "date-time",
      "description": "ISO 8601 timestamp of last state update"
    },
    "learner_model": {
      "type": "object",
      "description": "Dynamic learner model — updated after each diagnostic, lesson, and review cycle",
      "properties": {
        "schema_version": {
          "type": "string",
          "description": "Internal learner_model schema version (independent of the outer session schema_version)"
        },
        "concept_mastery": {
          "type": "object",
          "description": "Maps concept_tag -> mastery record",
          "additionalProperties": {
            "type": "object",
            "properties": {
              "lesson_index": {
                "type": "integer",
                "description": "Lesson where this concept was taught"
              },
              "mastery_level": {
                "type": "string",
                "enum": ["untested", "weak", "developing", "strong"],
                "description": "Aggregated mastery across all assessments"
              },
              "confidence_bias": {
                "type": "string",
                "enum": ["underconfident", "calibrated", "overconfident", "unknown"],
                "description": "Pattern: high confidence + poor results = overconfident"
              },
              "misconception_tags": {
                "type": "array",
                "items": { "type": "string" },
                "description": "Persistent error pattern labels (e.g. 'confuses_mutability', 'off_by_one')"
              },
              "test_count": {
                "type": "integer",
                "minimum": 0
              },
              "correct_count": {
                "type": "integer",
                "minimum": 0
              },
              "last_tested_at": {
                "type": "string",
                "format": "date-time"
              }
            },
            "required": ["mastery_level", "confidence_bias", "test_count", "correct_count"],
            "additionalProperties": false
          }
        },
        "overall_confidence_bias": {
          "type": "string",
          "enum": ["underconfident", "calibrated", "overconfident", "unknown"],
          "description": "Aggregated confidence bias across all recent assessments"
        },
        "preferred_pace": {
          "type": "string",
          "enum": ["slow", "moderate", "fast"],
          "description": "Inferred from lesson completion speed and remediation frequency"
        },
        "bloom_target": {
          "type": "integer",
          "minimum": 1,
          "maximum": 6,
          "description": "Current target Bloom level (may be lowered by Step 3.5连续补救课后自动下调)"
        },
        "last_updated_at": {
          "type": "string",
          "format": "date-time"
        }
      },
      "required": ["concept_mastery", "overall_confidence_bias", "bloom_target", "last_updated_at"],
      "additionalProperties": false
    },
    "_file_paths": {
      "type": "object",
      "description": "Logical name to actual filename mapping for all session-level files. Allows renaming without breaking AI references.",
      "properties": {
        "summary": { "type": "string" },
        "roadmap": { "type": "string" },
        "ai_context": { "type": "string" },
        "session_state": { "type": "string" },
        "metrics": { "type": "string" },
        "review_queue": { "type": "string" },
        "course_overview": { "type": "string" },
        "source_coverage": { "type": "string" },
        "report": { "type": "string" }
      },
      "additionalProperties": { "type": "string" }
    },
    "lesson_titles": {
      "type": "array",
      "items": { "type": "string" },
      "description": "Ordered titles of all planned lessons in the roadmap (display-friendly names)"
    },
    "lesson_files": {
      "type": "array",
      "items": { "type": "string" },
      "description": "Ordered filenames of lessons aligned with lesson_titles (stored under lessons/)"
    },
    "lesson_variants": {
      "type": "object",
      "description": "Maps lesson id (e.g. '02.1') to variant metadata. Used when a lesson was regenerated with a newer template (e.g. v1 -> v2). Introduced by 2026-04-18 scenario-closure-feynman-design.",
      "additionalProperties": {
        "type": "object",
        "properties": {
          "active": {
            "type": "string",
            "description": "Currently active lesson file (the one students should read)"
          },
          "legacy": {
            "type": "array",
            "items": { "type": "string" },
            "description": "Archived older versions of this lesson"
          },
          "teaching_mode": {
            "type": "string",
            "enum": ["A", "B"],
            "description": "A = knowledge-structure oriented (single scenario); B = scenario-closure oriented (>=2 independent scenarios)"
          },
          "scenario_closures": {
            "type": "array",
            "items": { "type": "string" },
            "description": "List of closure names; required when teaching_mode='B'"
          },
          "notes_dir": {
            "type": "string",
            "description": "Relative path to the per-lesson notes directory (holds my_notes.md + photos/ + exercises/)"
          },
          "regenerated_at": {
            "type": "string",
            "format": "date-time",
            "description": "ISO 8601 timestamp when this variant became active"
          },
          "regeneration_reason": {
            "type": "string",
            "description": "Human-readable reason for regeneration (e.g. template upgrade, mastery failure postmortem)"
          }
        },
        "required": ["active"],
        "additionalProperties": false
      }
    },
    "reset_log": {
      "type": "array",
      "description": "Audit trail of session-level resets (topic restructure, lesson regeneration, roadmap changes)",
      "items": {
        "type": "object",
        "properties": {
          "at": { "type": "string", "format": "date-time" },
          "reason": { "type": "string" },
          "prev": { "type": "object", "additionalProperties": true }
        },
        "required": ["at", "reason"],
        "additionalProperties": false
      }
    }
  },
  "additionalProperties": false
}
