{
  "schema_version": "2.3",
  "topic_id": "",
  "topic_name": "",
  "source_path": "",
  "processed_path": "",
  "source_hash": "",
  "phase": "init",
  "current_lesson": 0,
  "total_lessons": 0,
  "last_completed_lesson": 0,
  "mastery_passed": 0,
  "mastery_failed": 0,
  "mastery_rate": 0.0,
  "counterfactual_mode": null,
  "learning_language": "",
  "wait_reason": null,
  "repo_commit_hash": null,
  "current_mode": "learn",
  "lesson_files_learn": [],
  "lesson_files_practice": [],
  "lesson_files_core": [],
  "lesson_files_deep": [],
  "mode_switch_log": [],
  "learner_model": {
    "schema_version": "1.0",
    "concept_mastery": {},
    "overall_confidence_bias": "unknown",
    "preferred_pace": "moderate",
    "bloom_target": 3,
    "last_updated_at": ""
  },
  "created_at": "",
  "updated_at": "",
  "_file_paths": {
    "summary": "summary.md",
    "roadmap": "roadmap_status.md",
    "ai_context": "_ai_context.md",
    "session_state": "session_state.json",
    "metrics": "metrics.json",
    "review_queue": "review_queue.json",
    "course_overview": "course_overview.md",
    "source_coverage": "source_coverage/",
    "report": "report.md"
  }
}
